{
  "$ref": "#/definitions/experiences",
  "definitions": {
    "experiences": {
      "type": "object",
      "properties": {
        "company": {
          "type": "string"
        },
        "role": {
          "type": "string"
        },
        "description": {
          "type": "array",
          "items": {
            "type": "string"
          }
        },
        "image": {
          "type": "object",
          "properties": {
            "url": {
              "type": "string"
            },
            "alt": {
              "type": "string"
            }
          },
          "required": [
            "url",
            "alt"
          ],
          "additionalProperties": false
        },
        "startDate": {
          "type": "string"
        },
        "endDate": {
          "type": "string"
        },
        "skills": {
          "type": "array",
          "items": {
            "type": "string"
          }
        },
        "$schema": {
          "type": "string"
        }
      },
      "required": [
        "company",
        "role",
        "startDate"
      ],
      "additionalProperties": false
    }
  },
  "$schema": "http://json-schema.org/draft-07/schema#"
}